{
  "numero": "DV-2026-017",
  "client": "c-0552",
  "objet": "Pompe à chaleur air-eau",
  "lignes": [
    {
      "code": "PAC-02",
      "libelle": "Pompe à chaleur air-eau 12 kW",
      "quantite": 1,
      "prix_unitaire_ht_euros": 9900,
      "taux_tva": 5.5,
      "montant_ht_euros": 9900
    },
    {
      "code": "DEP-01",
      "libelle": "Dépose et évacuation de l'ancien appareil",
      "quantite": 1,
      "prix_unitaire_ht_euros": 180,
      "taux_tva": 5.5,
      "montant_ht_euros": 180
    },
    {
      "code": "TUB-01",
      "libelle": "Tuyauterie cuivre posée",
      "quantite": 10,
      "prix_unitaire_ht_euros": 42,
      "taux_tva": 5.5,
      "montant_ht_euros": 420
    },
    {
      "code": "ELE-01",
      "libelle": "Raccordement électrique",
      "quantite": 1,
      "prix_unitaire_ht_euros": 160,
      "taux_tva": 5.5,
      "montant_ht_euros": 160
    },
    {
      "code": "MES-01",
      "libelle": "Mise en service",
      "quantite": 1,
      "prix_unitaire_ht_euros": 150,
      "taux_tva": 5.5,
      "montant_ht_euros": 150
    },
    {
      "code": "MO-01",
      "libelle": "Main-d'œuvre de technicien",
      "quantite": 14,
      "prix_unitaire_ht_euros": 58,
      "taux_tva": 5.5,
      "montant_ht_euros": 812
    },
    {
      "code": "THE-01",
      "libelle": "Thermostat d'ambiance connecté",
      "quantite": 1,
      "prix_unitaire_ht_euros": 210,
      "taux_tva": 5.5,
      "montant_ht_euros": 210
    }
  ],
  "remise_pourcent": 0,
  "total_ht_euros": 11832,
  "total_tva_euros": 650.76,
  "total_ttc_euros": 12482.76,
  "statut": "envoye",
  "cree_le": "2026-11-23T10:00:00+01:00",
  "cree_par": "julie.perrin",
  "envoye_le": "2026-12-09T11:30:00+01:00",
  "reponse_le": null
}
